codigo,name,description,category,brand,price,stock_quantity,status,images
TP-ARCHER-C86,TP-ARCHER-C86,AC1900 ROUTER WIFI DOBLE BANDA 2.4-5GHZ 6 ANTENAS,NETWORKING,TP-Link,208.71,100,active,TP-ARCHER-C86.webp
TP-EAP110,TP-EAP110,ACCESS POINT 300MBPS 2.4GHZ BUSINESS INTERIOR,NETWORKING,TP-Link,128.32,100,active,TP-EAP110.webp
TP-EAP225-OUTDOOR,TP-EAP225-OUTDOOR,ACCESS POINT 400MBPS 2.4/5 GHZ BUSINESS EXTERIOR,NETWORKING,TP-Link,307.72,100,active,TP-EAP225-OUTDOOR.webp
TP-EAP225,TP-EAP225,ACCESS POINT 400MBPS 2.4/5 GHZ BUSINESS INTERIOR,NETWORKING,TP-Link,303.79,100,active,TP-EAP225.webp
TP-EAP265HD,TP-EAP265HD,ACCESS POINT AC1750 P/TECHO 2.4/5 GHZ BUSINESS INTERIOR,NETWORKING,TP-Link,418.39,100,active,TP-EAP265HD.webp
TP-EAP620-HD,TP-EAP620-HD,ACCESS POINT AX1800 P/TECHO WIFI 6,NETWORKING,TP-Link,536.84,100,active,TP-EAP620-HD.webp
TP-EAP660-HD,TP-EAP660-HD,ACCESS POINT AX3600 P/TECHO WIFI 6,NETWORKING,TP-Link,877.31,100,active,TP-EAP660-HD.webp
TP-EAP773,TP-EAP773,ACCESS POINT OMADA WIFI 7 P/TECHO,NETWORKING,TP-Link,1213.80,100,active,TP-EAP773.webp
TP-EAP610-OUTDOOR,TP-EAP610-OUTDOOR,ACCESS POINT WIFI 6 AX1800  2.4/5 GHZ INT/EXT,NETWORKING,TP-Link,606.90,100,active,TP-EAP610-OUTDOOR.webp
TP-EAP615-WALL,TP-EAP615-WALL,ACCESS POINT WIFI 6 AX1800  P/PARED,NETWORKING,TP-Link,337.19,100,active,TP-EAP615-WALL.webp
TP-EAP610,TP-EAP610,ACCESS POINT WIFI 6 AX1800  P/TECHO,NETWORKING,TP-Link,438.64,100,active,TP-EAP610.webp
TP-EAP650,TP-EAP650,ACCESS POINT WIFI 6 AX3000  2.4/5 GHZ INT,NETWORKING,TP-Link,525.70,100,active,TP-EAP650.webp
TP-EAP650-OUTDOOR,TP-EAP650-OUTDOOR,ACCESS POINT WIFI 6 AX3000  2.4/5 GHZ INT/EXT,NETWORKING,TP-Link,640.99,100,active,TP-EAP650-OUTDOOR.webp
TP-EAP655-WALL,TP-EAP655-WALL,ACCESS POINT WIFI 6 AX3000  P/PARED,NETWORKING,TP-Link,371.22,100,active,TP-EAP655-WALL.webp
HK-DS-MH-BRACKET,HK-DS-MH-BRACKET,ADAPTADOR DE BODYCAM PARA ARNES,CCTV,Hikvision,68.91,100,active,HK-DS-MH-BRACKET.webp
TP-UB500,TP-UB500,ADAPTADOR USB BLUETOOTH PARA MUSICA,NETWORKING,TP-Link,25.92,100,active,TP-UB500.webp
TP-TL-WN725N,TP-TL-WN725N,ADAPTADOR USB INALAMBRICO 150MBPS 2.4GHZ,NETWORKING,TP-Link,24.65,100,active,TP-TL-WN725N.webp
TP-TL-WN823N,TP-TL-WN823N,ADAPTADOR USB INALAMBRICO 300MBPS 2.4GHZ,NETWORKING,TP-Link,34.13,100,active,TP-TL-WN823N.webp
TP-ARCHER-T3U-NANO,TP-ARCHER-T3U-NANO,ADAPTADOR USB NANO WIFI DOBLE BANDA AC1300,NETWORKING,TP-Link,65.13,100,active,TP-ARCHER-T3U-NANO.webp
TP-ARCHER-TX20UH,TP-ARCHER-TX20UH,ADAPTADOR USB WIFI 6 AX1800 DOBLE BANDA,NETWORKING,TP-Link,163.14,100,active,TP-ARCHER-TX20UH.webp
TP-ARCHER-TX20U-PLUS,TP-ARCHER-TX20U-PLUS,ADAPTADOR USB WIFI 6 AX1800 DOBLE BANDA 2.4-5GHZ,NETWORKING,TP-Link,130.27,100,active,TP-ARCHER-TX20U-PLUS.webp
TP-ARCHER-T2UB-NANO,TP-ARCHER-T2UB-NANO,ADAPTADOR USB WIFI BLUETOOTH AC600 2.4-5GHZ,NETWORKING,TP-Link,45.53,100,active,TP-ARCHER-T2UB-NANO.webp
TP-ARCHER-T2U-NANO,TP-ARCHER-T2U-NANO,ADAPTADOR USB WIFI DOBLE BANDA 200MBPS 2.4-5GHZ,NETWORKING,TP-Link,42.35,100,active,TP-ARCHER-T2U-NANO.webp
TP-ARCHER-T2U,TP-ARCHER-T2U,ADAPTADOR USB WIFI DOBLE BANDA 2.4-5GHZ,NETWORKING,TP-Link,48.70,100,active,TP-ARCHER-T2U.webp
TP-ARCHER-T2U-PLUS,TP-ARCHER-T2U-PLUS,ADAPTADOR USB WIFI DOBLE BANDA 2.4-5GHZ ANTENA EXTERNA,NETWORKING,TP-Link,58.83,100,active,TP-ARCHER-T2U-PLUS.webp
TP-ARCHER-T3U-PLUS,TP-ARCHER-T3U-PLUS,ADAPTADOR USB WIFI DOBLE BANDA AC1300,NETWORKING,TP-Link,71.45,100,active,TP-ARCHER-T3U-PLUS.webp
TP-ARCHER-T4U-PLUS,TP-ARCHER-T4U-PLUS,ADAPTADOR USB WIFI DOBLE BANDA AC1300 ANTENA EXTERNA,NETWORKING,TP-Link,97.99,100,active,TP-ARCHER-T4U-PLUS.webp
TP-TL-WN722N,TP-TL-WN722N,ADAPTADOR USB WIFI GRAN POTENCIA 150MBPS 2.4GHZ 1 ANTENA,NETWORKING,TP-Link,39.22,100,active,TP-TL-WN722N.webp
TP-TL-WN822N,TP-TL-WN822N,ADAPTADOR USB WIFI GRAN POTENCIA 300MBPS 2.4GHZ,NETWORKING,TP-Link,49.28,100,active,TP-TL-WN822N.webp
TP-TL-WN8200ND,TP-TL-WN8200ND,ADAPTADOR USB WIFI GRAN POTENCIA 300MBPS 2.4GHZ 2 ANTENA,NETWORKING,TP-Link,68.32,100,active,TP-TL-WN8200ND.webp
HK-DS-KH6000-E1,HK-DS-KH6000-E1,ANEXO INTERIOR SIN PANTALLA PARA VIDEOPORTERO,VIDEO PORTEROS E INTERCOMUNICADORES,Hikvision,102.58,100,active,HK-DS-KH6000-E1.webp
HY-AN0435W09,HY-AN0435W09,ANTENA UHF DE 16CM PARA RADIO 400-470MHZ,RADIOS MOVILES,Hytera,31.27,100,active,HY-AN0435W09.webp
HY-AN0141H08,HY-AN0141H08,ANTENA VHF DE 12CM PARA RADIO 136-147MHZ,RADIOS MOVILES,Hytera,31.27,100,active,HY-AN0141H08.webp
HY-AN0160H13,HY-AN0160H13,ANTENA VHF DE 15CM PARA RADIO 146-174MHZ,RADIOS MOVILES,Hytera,31.27,100,active,HY-AN0160H13.webp
HY-AN0155H08,HY-AN0155H08,ANTENA VHF DE 20CM PARA RADIO 136-174MHZ,RADIOS MOVILES,Hytera,76.85,100,active,HY-AN0155H08.webp
TP-EAP245,TP-EAP245,AP AC1750 P/TECHO 2.4/5 GHZ BUSINESS INTERIOR,NETWORKING,TP-Link,390.88,100,active,TP-EAP245.webp
TP-EAP653,TP-EAP653,AP AX3000 WIFI 6 P/TECHO 2.4/5 GHZ BUSINESS INTERIOR,NETWORKING,TP-Link,472.02,100,active,TP-EAP653.webp
TP-EAP670,TP-EAP670,AP AX5400 WIFI 6 P/TECHO 2.4/5 GHZ BUSINESS INTERIOR,NETWORKING,TP-Link,674.37,100,active,TP-EAP670.webp
HK-DS-3WF0FA-2N/O,HK-DS-3WF0FA-2N/O,AP INALAM EXTERIOR 2.4GHZ 300MBPS 1 KM ANTENA 7DBI 2X2 MIMO 65°,NETWORKING,Hikvision,128.79,100,active,HK-DS-3WF0FA-2NO.webp
ZK-D3180,ZK-D3180,ARCO DETECTOR DE METALES (2),CONTROL ACCESO Y ASISTENCIA,ZKTeco,3704.69,100,active,ZK-D3180.webp
HK-DS-MH1711-HM,HK-DS-MH1711-HM,ARNES PARA BODYCAM (2),CCTV,Hikvision,169.59,100,active,HK-DS-MH1711-HM.webp
HY-EHM15-A,HY-EHM15-A,AURICULAR CON MICROFONO MANOS LIBRES,RADIOS MOVILES,Hytera,71.55,100,active,HY-EHM15-A.webp
HY-EHN37-P,HY-EHN37-P,AURICULAR CON MICROFONO MANOS LIBRES (2),RADIOS MOVILES,Hytera,66.25,100,active,HY-EHN37-P.webp
HY-SM50N1-P,HY-SM50N1-P,AURICULAR CON MICROFONO P/AP516,RADIOS MOVILES,Hytera,143.09,100,active,HY-SM50N1-P.webp
HY-EAS07,HY-EAS07,AURICULAR CON MICROFONO P/PNC360S/380,RADIOS MOVILES,Hytera,76.31,100,active,HY-EAS07.webp
HY-EAN22,HY-EAN22,AURICULAR CON PTT,RADIOS MOVILES,Hytera,205.11,100,active,HY-EAN22.webp
HY-EAN23,HY-EAN23,AURICULAR CON TUBO ACUSTICO,RADIOS MOVILES,Hytera,156.34,100,active,HY-EAN23.webp
HK-DS-PA201PS-KIT-16WB,HK-DS-PA201PS-KIT-16WB,AX HOME KIT ALARMA 4G 16 ZONAS. INC: PANEL PIR MAGN Y PULSADOR,ALARMA ROBOS,Hikvision,589.35,100,active,HK-DS-PA201PS-KIT-16WB.webp
HK-DS-PA201P-KIT-16WB,HK-DS-PA201P-KIT-16WB,AX HOME KIT ALARMA WIFI 16 ZONAS. INC: PANEL PIR MAGN Y PULSADOR,ALARMA ROBOS,Hikvision,356.03,100,active,HK-DS-PA201P-KIT-16WB.webp
HK-DS-PD201MC-WB,HK-DS-PD201MC-WB,AX HOME MAGNETICO INALAMBRICO,ALARMA ROBOS,Hikvision,55.66,100,active,HK-DS-PD201MC-WB.webp
HK-DS-PC201N,HK-DS-PC201N,AX HOME MODULO LAN PARA PANELES DS-PA201-KIT,ALARMA ROBOS,Hikvision,24.38,100,active,HK-DS-PC201N.webp
HK-DS-PD201P10-WB,HK-DS-PD201P10-WB,AX HOME PIR INALAMBRICO,ALARMA ROBOS,Hikvision,76.85,100,active,HK-DS-PD201P10-WB.webp
HK-DS-PKF201-WB,HK-DS-PKF201-WB,AX HOME PULSADOR INALAMBRICO DE ARMADO Y DESARMADO,ALARMA ROBOS,Hikvision,45.85,100,active,HK-DS-PKF201-WB.webp
HK-DS-PS201-WB,HK-DS-PS201-WB,AX HOME SIRENA INALAMBRICA PARA INTERIOR,ALARMA ROBOS,Hikvision,98.20,100,active,HK-DS-PS201-WB.webp
HK-DS-PK201B-WB,HK-DS-PK201B-WB,AX HOME TECLADO INALAMBRICO,ALARMA ROBOS,Hikvision,104.73,100,active,HK-DS-PK201B-WB.webp
HK-DS-PHA64-KIT,HK-DS-PHA64-KIT,AX HYBRID PRO KIT DE ALARMA HIBRIDA 8Z CON DISPOSITIVOS CABLEADOS,ALARMA ROBOS,Hikvision,504.56,100,active,HK-DS-PHA64-KIT.webp
HK-DS-PM2-S,HK-DS-PM2-S,AX HYBRID PRO MODULO COMUNICACION 3G/4G PARA PANEL PHA64,ALARMA ROBOS,Hikvision,278.25,100,active,HK-DS-PM2-S.webp
HK-DS-PM2-G,HK-DS-PM2-G,AX HYBRID PRO MODULO COMUNICACION GPRS PARA PANEL PHA64,ALARMA ROBOS,Hikvision,92.27,100,active,HK-DS-PM2-G.webp
HK-DS-PM1-I802-H,HK-DS-PM1-I802-H,AX HYBRID PRO MODULO EXPANSOR DE 8 ZONAS CABLEADAS,ALARMA ROBOS,Hikvision,108.66,100,active,HK-DS-PM1-I802-H.webp
HK-DS-PK1-LRT-HWB,HK-DS-PK1-LRT-HWB,AX HYBRID PRO TECLADO LCD PARA PANEL DE ALARMA DS-PHA64,ALARMA ROBOS,Hikvision,206.70,100,active,HK-DS-PK1-LRT-HWB.webp
HK-DS-PM1-O1H-WB,HK-DS-PM1-O1H-WB,AX PRO COMUNICADOR DE 2 VIAS INALAMBRICO,CCTV,Hikvision,105.48,100,active,HK-DS-PM1-O1H-WB.webp
HK-DS-PM-WI1,HK-DS-PM-WI1,AX PRO EXPANSOR DE SEÑAL INALAMBRICA 1 CANAL,ALARMA ROBOS,Hikvision,67.00,100,active,HK-DS-PM-WI1.webp
HK-DS-PWA48-KIT-WB(LA),HK-DS-PWA48-KIT-WB(LA),AX PRO KIT ALARMA 3G/4G 48 ZONAS. INCLUYE PANEL PIR MAGN Y PULSADOR,ALARMA ROBOS,Hikvision,681.91,100,active,HK-DS-PWA48-KIT-WB(LA).webp
HK-DS-PWA48-KIT-WB,HK-DS-PWA48-KIT-WB,AX PRO KIT ALARMA WIFI 48 ZONAS. INCLUYE PANEL PIR MAGN Y PULSADOR,ALARMA ROBOS,Hikvision,446.45,100,active,HK-DS-PWA48-KIT-WB.webp
HK-DS-PDMC-EG2-WB,HK-DS-PDMC-EG2-WB,AX PRO MAGNETICO INALAMBRICO,ALARMA ROBOS,Hikvision,74.09,100,active,HK-DS-PDMC-EG2-WB.webp
HK-DS-PM1-O1L-WB,HK-DS-PM1-O1L-WB,AX PRO MODULO DE RELEE,ALARMA ROBOS,Hikvision,90.10,100,active,HK-DS-PM1-O1L-WB.webp
HK-DS-PM1-RT-HWB,HK-DS-PM1-RT-HWB,AX PRO MODULO EXPANSOR DE 32 ZONAS INALAMBRICAS,ALARMA ROBOS,Hikvision,154.76,100,active,HK-DS-PM1-RT-HWB.webp
HK-DS-PDP15P-EG2-WB,HK-DS-PDP15P-EG2-WB,AX PRO PIR INALAMBRICO,ALARMA ROBOS,Hikvision,103.35,100,active,HK-DS-PDP15P-EG2-WB.webp
HK-DS-PDPC12P-EG2-WB,HK-DS-PDPC12P-EG2-WB,AX PRO PIR INALAMBRICO CON CAMARA,ALARMA ROBOS,Hikvision,293.62,100,active,HK-DS-PDPC12P-EG2-WB.webp
HK-DS-PDTT15AM-LM-WB,HK-DS-PDTT15AM-LM-WB,AX PRO PIR INALAMBRICO MICROONDAS,ALARMA ROBOS,Hikvision,508.79,100,active,HK-DS-PDTT15AM-LM-WB.webp
HK-DS-PDEB1-EG2-WB,HK-DS-PDEB1-EG2-WB,AX PRO PULSADOR DE EMERGENCIA INALAMBRICO,ALARMA ROBOS,Hikvision,57.25,100,active,HK-DS-PDEB1-EG2-WB.webp
HK-DS-PDEBP1-EG2-WB,HK-DS-PDEBP1-EG2-WB,AX PRO PULSADOR DE EMERGENCIA PORTATIL INALAMBRICO,ALARMA ROBOS,Hikvision,58.52,100,active,HK-DS-PDEBP1-EG2-WB.webp
HK-DS-PKF1-WB,HK-DS-PKF1-WB,AX-PRO PULSADOR INALAMBRICO DE ARMADO Y DESARMADO,ALARMA ROBOS,Hikvision,66.25,100,active,HK-DS-PKF1-WB.webp
HK-DS-PR1-WB,HK-DS-PR1-WB,AX PRO REPETIDOR INALAMBRICO DE 2 VIAS,ALARMA ROBOS,Hikvision,247.02,100,active,HK-DS-PR1-WB.webp
HK-DS-PS1-E-WB,HK-DS-PS1-E-WB,AX PRO SIRENA INALAMBRICA EXTERIOR,ALARMA ROBOS,Hikvision,233.20,100,active,HK-DS-PS1-E-WB.webp
HK-DS-PS1-I-WB,HK-DS-PS1-I-WB,AX PRO SIRENA INALAMBRICA INTERIOR,ALARMA ROBOS,Hikvision,140.46,100,active,HK-DS-PS1-I-WB.webp
HK-DS-PK1-E-WB,HK-DS-PK1-E-WB,AX PRO TECLADO LED INALAMBRICO,ALARMA ROBOS,Hikvision,174.91,100,active,HK-DS-PK1-E-WB.webp
CS-BM1-R100-2D2WF-BE,CS-BM1-R100-2D2WF-BE,BABYCAM IP CON BATERIA WIFI 2.4 INTERIOR - CELESTE,CCTV,EZVIZ,371.17,100,active,CS-BM1-R100-2D2WF-BE.webp
CS-BM1-R100-2D2WF-RA,CS-BM1-R100-2D2WF-RA,BABYCAM IP CON BATERIA WIFI 2.4 INTERIOR - ROSADA,CCTV,EZVIZ,371.17,100,active,CS-BM1-R100-2D2WF-RA.webp
ST-TRAY,ST-TRAY,"BANDEJA METALICA PARA GABINETE DE PARED 19"" 600 X 600""""""",NETWORKING,Western Digital,29.16,100,active,ST-TRAY.webp
ST-BANDEJA1000,ST-BANDEJA1000,BANDEJA METALICA PARA GABINETES 600X1000,NETWORKING,Western Digital,88.14,100,active,ST-BANDEJA1000.webp
ST-BANDEJA800,ST-BANDEJA800,BANDEJA METALICA PARA GABINETES 600X800,NETWORKING,Western Digital,71.70,100,active,ST-BANDEJA800.webp
HK-DS-K3G200LX-R/DM55,HK-DS-K3G200LX-R/DM55,BARRERA PEATONAL BIDIREC|ACERO INOX SUS304|25 PERS X MIN|INTEGRABLE CON SISTEMA,CONTROL ACCESO Y ASISTENCIA,Hikvision,2003.41,100,active,HK-DS-K3G200LX-RDM55.webp
ZK-TS2022 PRO,ZK-TS2022 PRO,BARRERA TIPO TORNIQUETE CON LECTORAS Y CONTROLADOR,CONTROL ACCESO Y ASISTENCIA,ZKTeco,4867.88,100,active,ZK-TS2022 PRO.webp
ZK-TS2000PRO,ZK-TS2000PRO,BARRERA TIPO TORNIQUETE  SIMPLE,CONTROL ACCESO Y ASISTENCIA,ZKTeco,3101.56,100,active,ZK-TS2000PRO.webp
ZK-BG1030R,ZK-BG1030R,BARRERA VEHICULAR DERECHA BRAZO 3M,CONTROL ACCESO Y ASISTENCIA,ZKTeco,1908.00,100,active,ZK-BG1030R.webp
HK-DS-TMG300-DR,HK-DS-TMG300-DR,BARRERA VEHICULAR DERECHA DE BARRA RECTA CON LED,CCTV,Hikvision,2082.91,100,active,HK-DS-TMG300-DR.webp
ZK-BG1030L,ZK-BG1030L,BARRERA VEHICULAR IZQUIERDA BRAZO 3M,CCTV,ZKTeco,1908.00,100,active,ZK-BG1030L.webp
HK-DS-TMG300-DL,HK-DS-TMG300-DL,BARRERA VEHICULAR IZQUIERDA DE BARRA RECTA CON LED,CCTV,Hikvision,2082.91,100,active,HK-DS-TMG300-DL.webp
ZK-CMP200R,ZK-CMP200R,BARRERA VEHICULAR LADO DERECHO BRAZO TELESCOPICO 4.5M,CONTROL ACCESO Y ASISTENCIA,ZKTeco,1457.49,100,active,ZK-CMP200R.webp
ZK-CMP200L,ZK-CMP200L,BARRERA VEHICULAR LADO IZQUIERDO BRAZO TELESCOPICO 4.5M,CONTROL ACCESO Y ASISTENCIA,ZKTeco,1457.49,100,active,ZK-CMP200L.webp
HY-BP3501,HY-BP3501,BATERIA DE POLIMERO DE LITIO PARA VM7// SERIE: 23N2602128,RADIOS MOVILES,Hytera,0.00,100,active,HY-BP3501.webp
HY-BL1719,HY-BL1719,BATERIA REPUESTO PARA RADIOS 1650mAMP P/TC-508,RADIOS MOVILES,Hytera,166.96,100,active,HY-BL1719.webp
HY-BL1715,HY-BL1715,BATERIA REPUESTO PARA RADIOS 1700mAMP P/TC-320,RADIOS MOVILES,Hytera,76.85,100,active,HY-BL1715.webp
HY-BL1507,HY-BL1507,BATERIA REPUESTO PARA RADIOS BANDA LIBRE DE 1500mAMP,RADIOS MOVILES,Hytera,106.00,100,active,HY-BL1507.webp
HY-BL1506,HY-BL1506,BATERIA REPUESTO PARA RADIOS DE 1500mAMP P/BD506 Y BD616,RADIOS MOVILES,Hytera,111.30,100,active,HY-BL1506.webp
HY-BP4010,HY-BP4010,BATERIA REPUESTO PARA RADIOS DE 4000mAMP P/AP516,RADIOS MOVILES,Hytera,111.30,100,active,HY-BP4010.webp
HY-BP4008,HY-BP4008,BATERIA REPUESTO PARA RADIOS DE 4000mAMP P/PNC360S/380,RADIOS MOVILES,Hytera,83.74,100,active,HY-BP4008.webp
FZ-FUB-1270,FZ-FUB-1270,BATERIA SELLADA 12V / 7AMP (2),ALARMA ROBOS,Forza,86.13,100,active,FZ-FUB-1270.webp
FZ-FUB-1290,FZ-FUB-1290,BATERIA SELLADA 12V / 9AMP PARA UPS,ALARMA ROBOS,Forza,116.60,100,active,FZ-FUB-1290.webp
NEW-3584660,NEW-3584660,BOLSA 100 CONECTORES RJ45 PARA UTP CAT6,NETWORKING,NEWLINK,100.71,100,active,NEW-3584660.webp
NEW-3584699,NEW-3584699,BOLSA 100 CONECTORES RJ45 PARA UTP CAT6 (2),NETWORKING,NEWLINK,90.10,100,active,NEW-3584699.webp
NEW-15100BL,NEW-15100BL,BOLSA DE 100 CUBIERTAS PLASTICAS PARA RJ45 CAT5 Y CAT6,NETWORKING,NEWLINK,31.64,100,active,NEW-15100BL.webp
HK-DS-PD1-EB,HK-DS-PD1-EB,BOTON DE PANICO CABLEADO,ALARMA ROBOS,Hikvision,6.47,100,active,HK-DS-PD1-EB.webp
ZK-EX800A,ZK-EX800A,BOTON DE SALIDA METALICO,CONTROL ACCESO Y ASISTENCIA,ZKTeco,29.16,100,active,ZK-EX800A.webp
ZK-K1-1,ZK-K1-1,BOTON DE SALIDA METALICO (2),CONTROL ACCESO Y ASISTENCIA,ZKTeco,60.95,100,active,ZK-K1-1.webp
ZK-TLEB102-R,ZK-TLEB102-R,BOTON DE SALIDA SIN CONTACTO CON CONTROL REMOTO,CONTROL ACCESO Y ASISTENCIA,ZKTeco,95.41,100,active,ZK-TLEB102-R.webp
CS-T3C,CS-T3C,BOTON INALAMBRICO EMERGENCIA ARMADO/DESARMADO,ALARMA ROBOS,EZVIZ,51.95,100,active,CS-T3C.webp
HK-DS-3WF02-5AC/O,HK-DS-3WF02-5AC/O,BRIDGE INALAM EXTERIOR 5GHZ 867MBPS 1-5 KM,NETWORKING,Hikvision,378.43,100,active,HK-DS-3WF02-5ACO.webp
HK-DS-3WF0EC-2NT,HK-DS-3WF0EC-2NT,BRIDGE INALAM P/ASCENSORES 2.4GHZ 300MBPS 500M,NETWORKING,Hikvision,184.97,100,active,HK-DS-3WF0EC-2NT.webp
HK-DS2CE10DF0T-LPFS,HK-DS2CE10DF0T-LPFS,BULLET 2MP COLORVU SMART HYBRID LIGHT IR20M 2.8MM C/AUDIO,CCTV,Hikvision,100.12,100,active,HK-DS2CE10DF0T-LPFS.webp
HK-DS2CE12DF0T-LFS,HK-DS2CE12DF0T-LFS,BULLET 2MP COLORVU SMART HYBRID LIGHT IR40M 2.8MM C/AUDIO,CCTV,Hikvision,133.72,100,active,HK-DS2CE12DF0T-LFS.webp
HK-DS2CE16D0T-LPFS,HK-DS2CE16D0T-LPFS,BULLET 2MP SMART HYBRID LIGHT IR25M 2.8MM C/AUDIO,CCTV,Hikvision,84.80,100,active,HK-DS2CE16D0T-LPFS.webp
HK-DS2CE18D0T-LFS,HK-DS2CE18D0T-LFS,BULLET 2MP SMART HYBRID LIGHT IR 60M 28MM C/AUDIO,CCTV,Hikvision,144.05,100,active,HK-DS2CE18D0T-LFS.webp
HK-DS2CE16K0T-LPFS,HK-DS2CE16K0T-LPFS,BULLET 5MP 3K SMART HYBRID LIGHT IR 25M 2.8MM C/AUDIO,CCTV,Hikvision,117.66,100,active,HK-DS2CE16K0T-LPFS.webp
HK-DS2CE18K0T-LFS,HK-DS2CE18K0T-LFS,BULLET 5MP 3K SMART HYBRID LIGHT IR 60M 28MM C/AUDIO,CCTV,Hikvision,163.66,100,active,HK-DS2CE18K0T-LFS.webp
HK-DS2CE10KF0T-LFS,HK-DS2CE10KF0T-LFS,BULLET 5MP COLORVU SMART HYBRID LIGHT IR20M 2.8MM C/AUDIO,CCTV,Hikvision,137.48,100,active,HK-DS2CE10KF0T-LFS.webp
HK-DS2CE12KF3TP,HK-DS2CE12KF3TP,BULLET DOBLE LENTE 180° 3K COLORVU,CCTV,Hikvision,402.80,100,active,HK-DS2CE12KF3TP.webp
HK-DS2CE19D0T-VFIT3F,HK-DS2CE19D0T-VFIT3F,BULLET EXTERIOR 1080P IR 40M 2.8-12MM,CCTV,Hikvision,150.49,100,active,HK-DS2CE19D0T-VFIT3F.webp
HK-DS2CE19H0T-AIT3ZF,HK-DS2CE19H0T-AIT3ZF,BULLET EXTERIOR 5MP IR 40M 2.8-12MM,CCTV,Hikvision,229.77,100,active,HK-DS2CE19H0T-AIT3ZF.webp
HK-DS2CE16U0T-LPF,HK-DS2CE16U0T-LPF,BULLET EXTERIOR 8MP LENTE 2.8MM IR30M (2),CCTV,Hikvision,144.05,100,active,HK-DS2CE16U0T-LPF.webp
HK-DS2CD1023G2-LIU,HK-DS2CD1023G2-LIU,BULLET IP 2MP SMART HYBRID LIGHT 2.8MM CON IR Y AUDIO,CCTV,Hikvision,172.26,100,active,HK-DS2CD1023G2-LIU.webp
HK-DS2CD2643G2-LIZS2U/SRB,HK-DS2CD2643G2-LIZS2U/SRB,BULLET IP 4MP ACUSENSE SMART HYBRID LIGHT 2.8-12MM IR40M C/AUDIO C/STROBE Y SIRENA,CCTV,Hikvision,794.99,100,active,HK-DS2CD2643G2-LIZS2USRB.webp
HK-DS2CD2043G2-LI2U/SRB,HK-DS2CD2043G2-LI2U/SRB,BULLET IP 4MP ACUSENSE SMART HYBRID LIGHT 2.8MM IR40M C/AUDIO,CCTV,Hikvision,449.97,100,active,HK-DS2CD2043G2-LI2USRB.webp
HK-DS2CD2683G2-LIZS2U,HK-DS2CD2683G2-LIZS2U,BULLET IP 8MP ACUSENSE SMART HYBRID LIGHT LENTE MOTORIZADO 2.8-12MM,CCTV,Hikvision,943.82,100,active,HK-DS2CD2683G2-LIZS2U.webp
HK-DS2CD1T67G2HP-LIUF/SRB,HK-DS2CD1T67G2HP-LIUF/SRB,BULLET IP DOBLE LENTE 180° 6MP 2.8MM SMART HYBRID LIGHT IR30M,CCTV,Hikvision,545.90,100,active,HK-DS2CD1T67G2HP-LIUFSRB.webp
HY-PC155,HY-PC155,CABLE DE PROGRAMACION DE RADIOS BANDA LIBRE,RADIOS MOVILES,Hytera,104.41,100,active,HY-PC155.webp
HY-PC76,HY-PC76,CABLE DE PROGRAMACION DE RADIOS UHF Y VHF,RADIOS MOVILES,Hytera,115.01,100,active,HY-PC76.webp
ZK-10HD-C,ZK-10HD-C,CABLE HDMI DE 10 METROS,NETWORKING,ZKTeco,36.57,100,active,ZK-10HD-C.webp
ZK-15HD-C,ZK-15HD-C,CABLE HDMI DE 15M,NETWORKING,ZKTeco,47.70,100,active,ZK-15HD-C.webp
ZK-1.5HD-C,ZK-1.5HD-C,CABLE HDMI DE 1.5M,NETWORKING,ZKTeco,6.90,100,active,ZK-1.5HD-C.webp
ZK-30HD-C,ZK-30HD-C,CABLE HDMI DE 3M,NETWORKING,ZKTeco,10.07,100,active,ZK-30HD-C.webp
NEW-9805361,NEW-9805361,CABLE UTP CAT5E EXTERIOR CMX 4 PARES 24AWG NEGRO – 305M UL,NETWORKING,NEWLINK,467.28,100,active,NEW-9805361.webp
NEW-9805741,NEW-9805741,CABLE UTP CAT5E INTERIOR CM 4 PARES 24AWG GRIS – 305M UL,NETWORKING,NEWLINK,440.73,100,active,NEW-9805741.webp
NEW-9806361,NEW-9806361,CABLE UTP CAT6 EXTERIOR 4 PARES 23AWG NEGRO – 305M UL,NETWORKING,NEWLINK,626.57,100,active,NEW-9806361.webp
NEW-9806742,NEW-9806742,CABLE UTP CAT6 INTERIOR 4 PARES 23AWG AZUL – 305M UL,NETWORKING,NEWLINK,621.26,100,active,NEW-9806742.webp
HK-DS-K1T320EFWX-B,HK-DS-K1T320EFWX-B,C. ACCESO ASISTENCIA WIFI C/BATERIA|500 ROSTROS|1000 TARJETAS EM|1000 HUELLAS,CONTROL ACCESO Y ASISTENCIA,Hikvision,291.50,100,active,HK-DS-K1T320EFWX-B.webp
ZK-WD-010,ZK-WD-010,CAJA DE PVC 100X100X70MM,CCTV,ZKTeco,5.30,100,active,ZK-WD-010.webp
ZK-WD-003,ZK-WD-003,CAJA DE PVC 120X100X50MM,CCTV,ZKTeco,4.24,100,active,ZK-WD-003.webp
ZK-WD-015,ZK-WD-015,CAJA DE PVC 150X150X70MM,CCTV,ZKTeco,7.95,100,active,ZK-WD-015.webp
HK-DS2CD2423G2-IW,HK-DS2CD2423G2-IW,CAMARA CUBO WIFI 2MP C/LENTE 2.8MM INTERIOR,CCTV,Hikvision,118.19,100,active,HK-DS2CD2423G2-IW.webp
HK-DS2CD2443G2-IW,HK-DS2CD2443G2-IW,CAMARA CUBO WIFI 4MP C/LENTE 2.8MM INTERIOR,CCTV,Hikvision,147.33,100,active,HK-DS2CD2443G2-IW.webp
HK-DS-MH2311/32G/GLE,HK-DS-MH2311/32G/GLE,CAMARA DE CUERPO 4G,CCTV,Hikvision,4187.00,100,active,HK-DS-MH231132GGLE.webp
HK-DS-2TP21B-6AVF/W,HK-DS-2TP21B-6AVF/W,CAMARA DE MANO TERMICO BI-SPECTRUM,CCTV,Hikvision,5304.68,100,active,HK-DS-2TP21B-6AVFW.webp
HK-DS2CD2347G2P-LSU/SL,HK-DS2CD2347G2P-LSU/SL,CAMARA IP COLORVU TURRET PANORAMICA 4MP CON STROBE Y ALARMA AUDIBLE,CCTV,Hikvision,731.29,100,active,HK-DS2CD2347G2P-LSUSL.webp
HK-DS2CD6825G0/C-IVS,HK-DS2CD6825G0/C-IVS,CAMARA IP CONTEO DE PERSONAS DE 2 LENTES 2MM,CCTV,Hikvision,3079.29,100,active,HK-DS2CD6825G0C-IVS.webp
HK-DS2CV2Q21FD-IW,HK-DS2CV2Q21FD-IW,CAMARA IP MINI PT IR 2MP WIFI,CCTV,Hikvision,90.27,100,active,HK-DS2CV2Q21FD-IW.webp
HK-DS-2XM6222GI-IM/ND,HK-DS-2XM6222GI-IM/ND,CAMARA IP MOVIL TIPO BALA 2MP,CCTV,Hikvision,614.80,100,active,HK-DS-2XM6222GI-IMND.webp
HK-DS-2XM6222G1-ID,HK-DS-2XM6222G1-ID,CAMARA IP MOVIL TIPO BALA 2MP (3),CCTV,Hikvision,757.91,100,active,HK-DS-2XM6222G1-ID.webp
HK-DS2DE7A232IW-AEB(T5),HK-DS2DE7A232IW-AEB(T5),CAMARA IP PTZ 2MP 32X IR HASTA 200 METRO,CCTV,Hikvision,2544.00,100,active,HK-DS2DE7A232IW-AEB(T5).webp
CS-H6C-R105-1J4WF,CS-H6C-R105-1J4WF,CAMARA IP PTZ 4MP. LENTE 4MM (2),CCTV,EZVIZ,140.71,100,active,CS-H6C-R105-1J4WF.webp
CS-H6C-R105-1J5WF,CS-H6C-R105-1J5WF,CAMARA IP PTZ 5MP. LENTE 4MM,CCTV,EZVIZ,172.78,100,active,CS-H6C-R105-1J5WF.webp
HK-AE-VC21SI-ISF,HK-AE-VC21SI-ISF,CAMARA MOVIL DOMO 2MP,CCTV,Hikvision,450.50,100,active,HK-AE-VC21SI-ISF.webp
HK-DS2CD6365G0-IVS,HK-DS2CD6365G0-IVS,CAMARA OJO DE PEZ IP 6MP C/HEAT MAP. LENTE 1.27MM EXTERIOR,CCTV,Hikvision,1976.37,100,active,HK-DS2CD6365G0-IVS.webp
HK-AE-DC5313-C6,HK-AE-DC5313-C6,CAMARA PARA AUTOMOVIL,CCTV,Hikvision,403.22,100,active,HK-AE-DC5313-C6.webp
HK-AE-DC2018-K2,HK-AE-DC2018-K2,CAMARA P/AUTOMOVIL,CCTV,Hikvision,166.36,100,active,HK-AE-DC2018-K2.webp
HK-DS2AE7232TI-A,HK-DS2AE7232TI-A,"CAMARA PTZ 7"" 1080P 32X IR 120M""""""",CCTV,Hikvision,1964.97,100,active,HK-DS2AE7232TI-A.webp
HK-DS2CD2423G0-IW,HK-DS2CD2423G0-IW,CAMARA TIPO CUBO IR 2MP C/LENTE 2.8MM,CCTV,Hikvision,159.30,100,active,HK-DS2CD2423G0-IW.webp
HK-DS2CD2T47G2P-LSU/SL,HK-DS2CD2T47G2P-LSU/SL,CAMARA TUBO IP 4MP EXTERIOR PANORAMICA C/AUDIO Y ALARMA,CCTV,Hikvision,736.18,100,active,HK-DS2CD2T47G2P-LSUSL.webp
HK-DS-KV8213-WME1,HK-DS-KV8213-WME1,CAMARA VIDEO PORTERO 2 BOTONES,VIDEO PORTEROS E INTERCOMUNICADORES,Hikvision,518.76,100,active,HK-DS-KV8213-WME1.webp
HK-DS-KD8003-IME1,HK-DS-KD8003-IME1,CAMARA VIDEO PORTERO 2MP C/1 BOTON OJO DE PEZ,VIDEO PORTEROS E INTERCOMUNICADORES,Hikvision,344.50,100,active,HK-DS-KD8003-IME1.webp
HK-DS-KV8413-WME1,HK-DS-KV8413-WME1,CAMARA VIDEO PORTERO 4 BOTONES,VIDEO PORTEROS E INTERCOMUNICADORES,Hikvision,543.25,100,active,HK-DS-KV8413-WME1.webp
CS-CB2-R100-2D2WF,CS-CB2-R100-2D2WF,CAM IP 2MP INT C/BATERIA WIFI,CCTV,EZVIZ,241.69,100,active,CS-CB2-R100-2D2WF.webp
CS-CB2-R105-1K3F4GA-BK,CS-CB2-R105-1K3F4GA-BK,CAM IP 2MP INT C/BATERIA WIFI 4G 2000mAh,CCTV,EZVIZ,287.25,100,active,CS-CB2-R105-1K3F4GA-BK.webp
CS-CB1,CS-CB1,CAM IP 2MP INTERIOR C/BATERIA 1600MAH WIFI. LENTE 2.8MM,CCTV,EZVIZ,180.54,100,active,CS-CB1.webp
CS-EB3-R200-1K3FL4GA,CS-EB3-R200-1K3FL4GA,CAM IP 3MP CON BATERIA 5200mAh 4G,CCTV,EZVIZ,447.85,100,active,CS-EB3-R200-1K3FL4GA.webp
CS-H4-R201-1H3WKFL,CS-H4-R201-1H3WKFL,CAM IP DOMO EXT 3MP 2K WIFI 2.4GHZ LENTE 2.8MM,CCTV,EZVIZ,196.09,100,active,CS-H4-R201-1H3WKFL.webp
CS-H3C-R100-1K2WFL,CS-H3C-R100-1K2WFL,CAM IP EXT 2MP WIFI 2.4GHZ LENTE 2.8MM,CCTV,EZVIZ,148.67,100,active,CS-H3C-R100-1K2WFL.webp
CS-H3-R100-1H3WKFL,CS-H3-R100-1H3WKFL,CAM IP EXT 3MP 2K WIFI 2.4GHZ LENTE 2.8MM,CCTV,EZVIZ,205.11,100,active,CS-H3-R100-1H3WKFL.webp
CS-H3C-R100-1K3WKFL,CS-H3C-R100-1K3WKFL,CAM IP EXT 3MP WIFI 2.4GHZ LENTE 2.8MM,CCTV,EZVIZ,175.23,100,active,CS-H3C-R100-1K3WKFL.webp
CS-H3-R100-1J5WKFL,CS-H3-R100-1J5WKFL,CAM IP EXT 5MP WIFI 2.4GHZ LENTE 2.8MM,CCTV,EZVIZ,276.12,100,active,CS-H3-R100-1J5WKFL.webp
CS-H3C-R100-1J5WKFL,CS-H3C-R100-1J5WKFL,CAM IP EXT 5MP WIFI LENTE 2.8MM,CCTV,EZVIZ,238.95,100,active,CS-H3C-R100-1J5WKFL.webp
CS-H1C,CS-H1C,CAM IP INT 1080P WIFI 2.4GHZ. LENTE FIJO 2.8MM,CCTV,EZVIZ,103.54,100,active,CS-H1C.webp
CS-C60P-R100-8H33WF,CS-C60P-R100-8H33WF,CAM IP PT 2K 3MP INTERIOR DUAL BAND WIFI6,CCTV,EZVIZ,233.20,100,active,CS-C60P-R100-8H33WF.webp
CS-CB8-3MP,CS-CB8-3MP,CAM IP PT 3MP CON BATERIA WIFI,CCTV,EZVIZ,593.59,100,active,CS-CB8-3MP.webp
CS-CB8-R105(3MP)/SP,CS-CB8-R105(3MP)/SP,CAM IP PT 3MP CON BATERIA WIFI Y PANEL SOLAR,CCTV,EZVIZ,634.95,100,active,CS-CB8-R105(3MP)SP.webp
CS-H80F-R100-8G444WKFL,CS-H80F-R100-8G444WKFL,CAM IP PT DE 3 LENTES PARA EXTERIOR 4MP/2.8MM + 4MP/6MM + 4MP/12MM,CCTV,EZVIZ,397.50,100,active,CS-H80F-R100-8G444WKFL.webp
CS-H80X-R100-8G82WKFL,CS-H80X-R100-8G82WKFL,CAM IP PT DUAL 4K + 2MP EXT LENTE 4MM,CCTV,EZVIZ,350.32,100,active,CS-H80X-R100-8G82WKFL.webp
CS-H8C-R100-1K2WKFL,CS-H8C-R100-1K2WKFL,CAM IP PT EXT 2MP WIFI 2.4GHZ LENTE 4MM,CCTV,EZVIZ,146.02,100,active,CS-H8C-R100-1K2WKFL.webp
CS-H8C-R100-1J4WKFL,CS-H8C-R100-1J4WKFL,CAM IP PT EXT 4MP WIFI 2.4GHZ LENTE 4MM,CCTV,EZVIZ,223.67,100,active,CS-H8C-R100-1J4WKFL.webp
CS-H8C-R200-1J4WKFL,CS-H8C-R200-1J4WKFL,CAM IP PT EXT 4MP WIFI 2.4GHZ LENTE 4MM (2),CCTV,EZVIZ,201.78,100,active,CS-H8C-R200-1J4WKFL.webp
CS-H8-R100-1J5WKFL,CS-H8-R100-1J5WKFL,CAM IP PT EXT 5MP WIFI 2.4GHZ LENTE 4MM,CCTV,EZVIZ,300.50,100,active,CS-H8-R100-1J5WKFL.webp
CS-H8C-R200-1J5WKFL,CS-H8C-R200-1J5WKFL,CAM IP PT EXT 5MP WIFI LENTE 4MM (2),CCTV,EZVIZ,255.99,100,active,CS-H8C-R200-1J5WKFL.webp
CS-H6C-R105-1L2WF,CS-H6C-R105-1L2WF,CAM IP PT INTER 2MP 1080P WIFI LENTE 4MM,CCTV,EZVIZ,104.60,100,active,CS-H6C-R105-1L2WF.webp
CS-H6C-R105-1L3WF,CS-H6C-R105-1L3WF,CAM IP PT INTER 3MP WIFI LENTE 4MM,CCTV,EZVIZ,126.90,100,active,CS-H6C-R105-1L3WF.webp
CS-H9C-R100-8G55WKFL,CS-H9C-R100-8G55WKFL,CAM IP PT LENTE DUAL EXTERIOR 10MP WIFI LENTE 2.8+6MM,CCTV,EZVIZ,290.00,100,active,CS-H9C-R100-8G55WKFL.webp
CS-H9C-R100-8H33WKFL,CS-H9C-R100-8H33WKFL,CAM IP PT LENTE DUAL EXTERIOR 6MP WIFI LENTE 2.8+6MM,CCTV,EZVIZ,270.00,100,active,CS-H9C-R100-8H33WKFL.webp
CS-H90-R100-8H44WKFL,CS-H90-R100-8H44WKFL,CAM IP PT LENTE DUAL EXTERIOR 8MP WIFI LENTE 2.8+6MM,CCTV,EZVIZ,350.85,100,active,CS-H90-R100-8H44WKFL.webp
CS-H7C-R100-8G44WF,CS-H7C-R100-8G44WF,CAM IP PT LENTE DUAL INTERIOR 8MP WIFI LENTE 2.8+6MM,CCTV,EZVIZ,193.81,100,active,CS-H7C-R100-8G44WF.webp
HK-DS-MH1411-N1,HK-DS-MH1411-N1,CARGADOR DE BATERIA PARA BODYCAM,CCTV,Hikvision,212.00,100,active,HK-DS-MH1411-N1.webp
HY-CH10A07,HY-CH10A07,CARGADOR DE RADIO BANDA LIBRE PARA MESA SIN FUENTE,RADIOS MOVILES,Hytera,83.74,100,active,HY-CH10A07.webp
HY-CH10L23,HY-CH10L23,CARGADOR DE RADIO PARA MESA SIN FUENTE,RADIOS MOVILES,Hytera,55.66,100,active,HY-CH10L23.webp
HY-CHV09,HY-CHV09,CARGADOR DE RADIO VEHICULAR - ADAPTADOR,RADIOS MOVILES,Hytera,222.59,100,active,HY-CHV09.webp
HK-DS-MDS003-E,HK-DS-MDS003-E,CARGADOR X 8 PUERTOS P/BODYCAM,CCTV,Hikvision,4027.99,100,active,HK-DS-MDS003-E.webp
ZK-LM-1805,ZK-LM-1805,C. ELECTROMAGNETICA 120kg ±8 % - 12VDC,CONTROL ACCESO Y ASISTENCIA,ZKTeco,81.61,100,active,ZK-LM-1805.webp
